{
  "schema_version": 1,
  "suite_id": "context_pilots",
  "workflow_id": "mention_attachment_chain",
  "description": "Uses @AssetName mentions so ApplyMentionsFromPrompt attaches assets; second step checks follow-up on same thread.",
  "thread_strategy": "reuse_guid",
  "default_mode": "agent",
  "steps": [
    {
      "id": "mention_asset",
      "message_file": "prompts/step_01.txt",
      "notes": "Requires SimpleBlueprint.uasset under Content/Blueprints (default blank project).",
      "tags": ["mentions", "attachments"]
    },
    {
      "id": "follow_up_same_thread",
      "message_file": "prompts/step_02.txt",
      "expect_context_hints": "Context should still include prior attachment/tool context where applicable.",
      "tags": ["mentions", "attachments"]
    }
  ]
}
